,abv,beer,beer_url,brewery,brewery_profile_url,gots,note,pdev,rank,rating,ratings_count,review_count,style,trade,wants,review_id
2177,6.0,mo,https://www.beeradvocate.com/beer/profile/20681/78906/,maine beer company,/beer/profile/20681/,772.0,"Just after opening our brewery, working long nights, weekends, and still maintaining our day jobs, my brother Daniel (the brewer) had twins. Cheers to his courage and dedication to making better beer.

Flavors and aromas of zesty citrus, passionfruit, and pine present themselves throughout. A very subtle malt sweetness for balance, but this is intended to finish dry.",8.18,1272.0,4.28,3372.0,511.0,american pale ale (apa),19.0,297.0,maine beer company mo
1843,4.9,summer bitter summer not,https://www.beeradvocate.com/beer/profile/578/19330/,the liberal cup public house & brewery,/beer/profile/578/,0.0,"A lighter, cask-conditioned version of our IPA, with just enough tingle to remind you how great it is to be in Maine in the summer.",7.85,18345.0,3.95,10.0,5.0,english india pale ale (ipa),0.0,1.0,the liberal cup public house & brewery summer bitter summer not
2304,6.6,fort point pale ale,https://www.beeradvocate.com/beer/profile/30654/88949/,trillium brewing company,/beer/profile/30654/,519.0,"Our signature American pale ale balances light, crisp, malt character with an abundance of hop-derived aromatics and flavors from the use of Citra and Columbus. The fragrant nose is fresh citrus, tropical fruit, and peach. Bold flavors of pineapple and mango mix with dank notes of zesty citrus and fresh pine needles. With the smooth mouthfeel, gentle bitterness, and dry finish, Fort Point is our standard daily-drinker. 

MALT: American 2-row Barley, White Wheat, C-15, Dextrine

HOPS: Citra, Columbus",6.28,249.0,4.46,2189.0,242.0,american pale ale (apa),5.0,447.0,trillium brewing company fort point pale ale
676,5.1,knuckleball,https://www.beeradvocate.com/beer/profile/33165/123421/,happy valley brewing company,/beer/profile/33165/,3.0,Vibrant citrus/hop aroma. Soft on the palate.,6.63,11026.0,4.07,18.0,1.0,american amber / red ale,0.0,2.0,happy valley brewing company knuckleball
1588,13.0,monster tones,https://www.beeradvocate.com/beer/profile/31987/325300/,modern times beer,/beer/profile/31987/,0.0,"This outlandishly delicious beer is the result of a 50/50 blend of Monsters’ Park and Modem Tones, both aged for 7 months in bourbon barrels which had previously housed maple syrup. Following the blend, the beer was conditioned on freshly-roasted coffee beans, toasted coconut, and a whole lot of vanilla. When it was all over, what arose was a dessert-laden beverage of the highest order, with flavors and aromas of tiramisu, coffee, chocolate, and roasted marshmallows.",4.85,187.0,4.74,29.0,6.0,american imperial stout,0.0,25.0,modern times beer monster tones
278,,captain cook's spruce tip ale,https://www.beeradvocate.com/beer/profile/829/29461/,haines brewing company,/beer/profile/829/,1.0,None provided.,9.88,11205.0,4.15,10.0,5.0,herb and spice beer,0.0,3.0,haines brewing company captain cook's spruce tip ale
2443,5.9,the arsonist,https://www.beeradvocate.com/beer/profile/29008/111775/,bluejacket / arsenal restaurant,/beer/profile/29008/,0.0,None provided.,17.0,36708.0,3.53,15.0,0.0,smoke beer,0.0,0.0,bluejacket / arsenal restaurant the arsonist
596,8.0,pliny the elder,https://www.beeradvocate.com/beer/profile/863/7971/,russian river brewing company,/beer/profile/863/,4708.0,"Pliny the Elder is brewed with Amarillo, Centennial, CTZ, and Simcoe hops. It is well-balanced with malt, hops, and alcohol, slightly bitter with a fresh hop aroma of floral, citrus, and pine. Best enjoyed FRESH! That is why we make it in such limited supply. Actual bottling date is printed on each bottle!",7.76,27.0,4.64,15143.0,3796.0,american imperial ipa,102.0,7551.0,russian river brewing company pliny the elder
137,4.7,spezial rauchbier lager,https://www.beeradvocate.com/beer/profile/913/2960/,brauerei spezial,/beer/profile/913/,6.0,"Unser Lagerbier ist die bekannteste Rauchbiersorte aus unserem Spezialitätenangebot. Das bernsteinfarbige Bier mit seinem feinem, mildem Rauchgeschmack lässt auch Skeptiker zum überzeugten Rauchbierfan werden. Der Stammwürzgehalt dieses Bieres beträgt ca.12% - daraus resultiert der Alkoholgehalt mit ca.4,7%",13.44,30181.0,3.72,297.0,235.0,german rauchbier,0.0,15.0,brauerei spezial spezial rauchbier lager
1507,4.2,lager,https://www.beeradvocate.com/beer/profile/199/402571/,ballast point brewing company,/beer/profile/199/,4.0,"Our Ballast Point Lager is the quintessential cooler beer for lively adventures or leisurely days. At only 99 calories, this incredibly bright lager still packs a ton of flavor. Brewed with 100% 2-Row barley and a light touch of Apollo hops, Ballast Point lager is a refreshing choice for any occasion. Whether you’re docked or at sea, it’s the perfect companion for whatever destination lies ahead.

10 IBU",16.14,,3.47,41.0,18.0,american light lager,0.0,1.0,ballast point brewing company lager
2422,5.1,reutberger export hell,https://www.beeradvocate.com/beer/profile/4154/12302/,klosterbrauerei reutberg,/beer/profile/4154/,7.0,None provided.,11.33,35957.0,3.62,67.0,44.0,european export / dortmunder,0.0,0.0,klosterbrauerei reutberg reutberger export hell
382,7.7,black cascade,https://www.beeradvocate.com/beer/profile/31326/104270/,hammerheart brewing company,/beer/profile/31326/,4.0,None provided.,7.67,6539.0,4.17,24.0,7.0,american black ale,0.0,2.0,hammerheart brewing company black cascade
2610,5.0,mill street jigger’s delight,https://www.beeradvocate.com/beer/profile/3760/284039/,mill street brew pub,/beer/profile/3760/,1.0,"From our St. John’s brewpub our California Common beer is an old style of table beer fermented warm and then aged cold for a unique smoothness. Whether yer a Bayman, a Townie or Come From Away, it’s a Rock solid pint.

26 IBU",10.94,41314.0,3.29,11.0,4.0,california common / steam beer,0.0,0.0,mill street brew pub mill street jigger’s delight
1716,7.6,wilderman,https://www.beeradvocate.com/beer/profile/31408/106555/,seventh son brewing co.,/beer/profile/31408/,5.0,None provided.,10.13,27371.0,3.75,21.0,2.0,french bière de garde,1.0,0.0,seventh son brewing co. wilderman
2178,5.0,nordic ale,https://www.beeradvocate.com/beer/profile/25567/106084/,castle danger brewery,/beer/profile/25567/,0.0,None provided.,8.17,31087.0,3.67,15.0,2.0,finnish sahti,0.0,0.0,castle danger brewery nordic ale
2019,5.4,chopfab amber,https://www.beeradvocate.com/beer/profile/33874/125914/,doppelleu brauwerkstatt,/beer/profile/33874/,6.0,None provided.,8.52,35946.0,3.52,11.0,3.0,american amber / red lager,0.0,0.0,doppelleu brauwerkstatt chopfab amber
1576,7.2,apeiron,https://www.beeradvocate.com/beer/profile/34737/177190/,infinite ale works,/beer/profile/34737/,3.0,None provided.,10.2,19119.0,3.92,12.0,2.0,belgian pale ale,0.0,0.0,infinite ale works apeiron
1160,4.0,squatters black forest schwarzbier,https://www.beeradvocate.com/beer/profile/28908/18381/,utah brewers cooperative,/beer/profile/28908/,2.0,"This tasty dark German lager is brewed with Pilsner, Munich, Special B and black malt hopped with 100% German Noble hops. Squatters Schwarzbeir has smooth roast undertones and is lightly hopped, leaving us with a malty delicious lager.",8.49,26295.0,3.77,37.0,8.0,german schwarzbier,0.0,1.0,utah brewers cooperative squatters black forest schwarzbier
2282,5.5,coffee bender,https://www.beeradvocate.com/beer/profile/13014/30764/,surly brewing company,/beer/profile/13014/,442.0,Bender steeped cold for 24 hours in coarsely ground coffee beans from the Vinca Vista Hermosa plantation in Guatemala.,10.6,3417.0,4.15,2724.0,872.0,american brown ale,23.0,679.0,surly brewing company coffee bender
223,8.8,phd malt liquor,https://www.beeradvocate.com/beer/profile/25937/82240/,greenbush brewing company,/beer/profile/25937/,3.0,None provided.,15.47,34248.0,3.62,23.0,3.0,american malt liquor,0.0,2.0,greenbush brewing company phd malt liquor
2528,5.8,timbo pils,https://www.beeradvocate.com/beer/profile/52228/243109/,highland park brewery,/beer/profile/52228/,1.0,"We took inspiration for this West Coast Hoppy Pilsner from both German Pilsners and West Coast IPAs. We used more German influenced hops in the kettle (Czech Saaz, Opal, and Saphir) which gives the beer a softer bitterness and a nice floral and earthy hop base. We then used Mosaic and Motueka for dry hopping to bring out the tropical west coast flavors of mango, riesling grapes, and passionfruit.",4.06,7085.0,4.19,18.0,4.0,german pilsner,0.0,0.0,highland park brewery timbo pils
750,6.0,oktoberfest,https://www.beeradvocate.com/beer/profile/4426/61955/,hinterland brewery restaurant,/beer/profile/4426/,15.0,"Joe, our Brew Master, went to Munich for a few days of inspiration for this Vienna style beer. He came back 3 weeks later, a little cloudy but focused on nailing this now popular brew.

MALT:	Vienna, 2 Row, Carafoam, Dark Wheat, Melanoidin
HOPS:	Hallertau

22 IBU",13.6,27806.0,3.75,136.0,47.0,vienna lager,0.0,7.0,hinterland brewery restaurant oktoberfest
117,5.5,chipotle ale,https://www.beeradvocate.com/beer/profile/132/354/,rogue ales,/beer/profile/132/,141.0,"Label of 22 oz bottle:

8 Ingredients: Harrington, Klages & Maier Munich Malts; Cascade & Willamette Hops; Chipotle Peppers, Free Range Coastal Waters & Top Fermenting Pacman Yeast.

No Chemicals, No Preservatives, No Additives.

Dedicated to Spanish author Juan de la Cueva, who, in 1575, wrote of a Mexican dish that combined seedless chipotles with ale.

This ale is deep amber in color with a rich malty aroma, and delicately spiced with smoked Jalapeno peppers to give it that extra bite!

Oregon Brewed - Established 1988

Oxygen Fixing Caps - 35 IBU",17.98,39899.0,3.56,1410.0,704.0,chile beer,1.0,105.0,rogue ales chipotle ale
1890,6.8,fractal,https://www.beeradvocate.com/beer/profile/31644/136300/,penrose brewing,/beer/profile/31644/,12.0,"With notes of mango and fresh pine on the nose, this damn fine Belgian IPA is loaded with citrusy hop bitterness up front, and finishes with a dank, resinous flavor. 

65 IBU",7.65,15095.0,3.92,75.0,4.0,belgian ipa,0.0,1.0,penrose brewing fractal
1155,5.2,robust porter,https://www.beeradvocate.com/beer/profile/11611/27424/,bridge road brewers,/beer/profile/11611/,4.0,None provided.,19.77,39876.0,3.49,29.0,21.0,robust porter ,0.0,0.0,bridge road brewers robust porter
373,5.5,darkest before dawn,https://www.beeradvocate.com/beer/profile/18854/188976/,new orleans lager & ale brewing company (nola),/beer/profile/18854/,2.0,"NOLA Brewing’s first lager will be a Munich Dunkel, a dark European lager that is a deep dark copper to brown color. Brewed with predominantly German Munich malts and a small amount of caramel and dark roasted barley, this beer will have a rich, malty aroma with a hint of sweet chocolate. This lager will not be a hoppy beer and the malt shines through on the tongue. Darkest Before Dawn will have an ABV between 5 and 5.5 percent.",6.2,11252.0,4.03,27.0,4.0,munich dunkel lager,0.0,1.0,new orleans lager & ale brewing company (nola) darkest before dawn
665,7.5,amstel extra,https://www.beeradvocate.com/beer/profile/163/66308/,amstel brouwerij b. v.,/beer/profile/163/,2.0,None provided.,14.39,45329.0,2.85,11.0,2.0,european strong lager,0.0,2.0,amstel brouwerij b. v. amstel extra
594,4.7,columbia common,https://www.beeradvocate.com/beer/profile/8/88470/,widmer brothers brewing company,/beer/profile/8/,11.0,None provided.,14.12,42256.0,3.47,234.0,48.0,california common / steam beer,0.0,7.0,widmer brothers brewing company columbia common
590,8.0,society & solitude #4,https://www.beeradvocate.com/beer/profile/22511/83008/,hill farmstead brewery,/beer/profile/22511/,127.0,Our experimental Double IPA experience continues. Hybrid Imperial IPA... Think Double Citra Meets Double Galaxy.,6.33,69.0,4.58,1335.0,178.0,new england ipa,0.0,445.0,hill farmstead brewery society & solitude #4
783,7.8,baby steps,https://www.beeradvocate.com/beer/profile/51968/369303/,definitive brewing company,/beer/profile/51968/,0.0,None provided.,5.76,5392.0,4.34,12.0,3.0,american stout,0.0,0.0,definitive brewing company baby steps
366,3.1,piwo z grodziska,https://www.beeradvocate.com/beer/profile/45369/227941/,browar w grodzisku wielkopolskim,/beer/profile/45369/,2.0,None provided.,12.97,30503.0,3.7,30.0,14.0,smoke beer,0.0,1.0,browar w grodzisku wielkopolskim piwo z grodziska
331,6.8,pseudo sue,https://www.beeradvocate.com/beer/profile/23222/72170/,toppling goliath brewing company,/beer/profile/23222/,1284.0,"This single hop ale showcases the Citra hop. Named for the largest T-rex fossil ever discovered, she roars with ferocious aromas of grapefruit, citrus, mango and evergreen. Delicate in body with a mild bite in the finish.

50 IBU",7.54,147.0,4.51,5190.0,798.0,american pale ale (apa),52.0,1342.0,toppling goliath brewing company pseudo sue
329,8.2,haze w/ peach,https://www.beeradvocate.com/beer/profile/28743/361931/,tree house brewing company,/beer/profile/28743/,2.0,None provided.,5.19,,4.62,16.0,1.0,new england ipa,0.0,2.0,tree house brewing company haze w/ peach
756,5.4,ruedrich's red seal ale,https://www.beeradvocate.com/beer/profile/112/410/,north coast brewing co.,/beer/profile/112/,242.0,"Malt and hops are beautifully married in this full-bodied, copper-red Pale Ale. Red Seal is generously hopped for a long, spicy finish. An excellent accompaniment to grilled meats and rich sauces.",11.83,16129.0,3.89,2129.0,1020.0,american amber / red ale,0.0,104.0,north coast brewing co. ruedrich's red seal ale
1152,11.0,chickow! - brandy barrel aged,https://www.beeradvocate.com/beer/profile/28556/309834/,triple digit brewing co.,/beer/profile/28556/,0.0,None provided.,4.18,7052.0,4.31,10.0,1.0,american brown ale,0.0,0.0,triple digit brewing co. chickow! - brandy barrel aged
1812,5.0,sapporo original draft beer,https://www.beeradvocate.com/beer/profile/284/827/,sapporo breweries ltd.,/beer/profile/284/,170.0,None provided.,21.5,46959.0,2.93,507.0,106.0,japanese rice lager,0.0,19.0,sapporo breweries ltd. sapporo original draft beer
1296,4.2,gossamer golden ale,https://www.beeradvocate.com/beer/profile/18006/54770/,half acre beer company,/beer/profile/18006/,43.0,None provided.,11.26,29453.0,3.73,372.0,128.0,american blonde ale,0.0,16.0,half acre beer company gossamer golden ale
1200,6.6,ruthless rye ipa,https://www.beeradvocate.com/beer/profile/140/76816/,sierra nevada brewing co.,/beer/profile/140/,835.0,"Rugged and resilient, rye has been a staple grain for ages and its spicy black pepper-like flavor has been prized by distillers and brewers for centuries. Rye thrives in the harshest conditions and comes to life in Ruthless, a rugged IPA with fruity, citrus and herbal hop notes countered by the dry spiciness of the rye. Holding a steadfast balance between contrasting malt and hop character, Ruthless is bold enough to inspire even the most brazen hop head to bear down and embrace the flavor.",11.31,16104.0,3.89,5227.0,1162.0,rye beer,0.0,112.0,sierra nevada brewing co. ruthless rye ipa
747,5.4,rogue farms chipotle ale,https://www.beeradvocate.com/beer/profile/132/124112/,rogue ales,/beer/profile/132/,30.0,"9 Ingredients: 2-Row, C40 Malts & Rogue Farms Dare™ & Risk™ Malts; Rogue Farms Liberty™ & Alluvial™ Hops; Chipotle Peppers; Free Range Coastal Water & Pacman Yeast.

22oz Bottle & Draft / 13° Plato / 40 IBU / 82 AA / 18° Lovibond",14.72,37264.0,3.6,90.0,19.0,chile beer,0.0,2.0,rogue ales rogue farms chipotle ale
1805,8.5,pernicieux,https://www.beeradvocate.com/beer/profile/28991/89370/,solemn oath brewery,/beer/profile/28991/,6.0,None provided.,6.84,24099.0,3.8,47.0,4.0,belgian dark ale,0.0,1.0,solemn oath brewery pernicieux
2337,6.6,old man winter ale,https://www.beeradvocate.com/beer/profile/28848/107221/,ribstone creek brewery,/beer/profile/28848/,8.0,None provided.,6.39,19309.0,3.91,13.0,3.0,english porter,1.0,2.0,ribstone creek brewery old man winter ale
478,8.0,duende,https://www.beeradvocate.com/beer/profile/34456/256764/,creature comforts,/beer/profile/34456/,8.0,"Duende is a hazy marigold in appearance with fluffy white foam. This beer is elegant for a Double IPA which leads to surprisingly easy drinkability. First impressions are a bright almost citrusy pine note that quickly switches gears to huge fruit notes: orange, grapefruit, apricot, and tangerine. There’s a consistent fruit flesh flavor to the beer that adds a wonderful complexity to the bright citrus notes as the overtones dance around the fleshy notes, supporting without ever getting in the way. As the flavor finishes there’s subtle earth and berry notes that come through and the beer finishes with a perfectly balanced bitterness that rounds out the alcohol sweetness and immediately invites you to take another sip.",6.04,555.0,4.47,59.0,22.0,american imperial ipa,0.0,19.0,creature comforts duende
584,5.0,gratitude,https://www.beeradvocate.com/beer/profile/37192/296786/,kent falls brewing company,/beer/profile/37192/,1.0,None provided.,7.59,17154.0,3.95,14.0,4.0,bohemian pilsener,0.0,0.0,kent falls brewing company gratitude
2264,8.0,tesseract,https://www.beeradvocate.com/beer/profile/32893/156482/,grimm artisanal ales,/beer/profile/32893/,125.0,We punched up our favorite DIPA with an extra dose of mosaic cryo hops. More lupulin oil and less vegetative matter delivers an even fruitier and smoother hop experience.,6.82,455.0,4.4,570.0,95.0,american imperial ipa,2.0,207.0,grimm artisanal ales tesseract
2224,3.6,snowdonia ale (cwrw eryri),https://www.beeradvocate.com/beer/profile/20459/50676/,purple moose brewery,/beer/profile/20459/,2.0,"A delightfully refreshing pale ale brewed with a delicate combination of aromatic hops.

Our most popular session beer - the perfect thirst-quencher after a hard day's walking in the glorious mountains of Snowdonia!",5.8,38692.0,3.45,13.0,3.0,english pale mild ale,0.0,2.0,purple moose brewery snowdonia ale (cwrw eryri)
2187,11.2,barrel aged double shot double black,https://www.beeradvocate.com/beer/profile/31383/213798/,bent paddle brewing co.,/beer/profile/31383/,65.0,"Barrel-Aged Double Shot Double Black Ale is an amped up version of the Duluth brewery’s Cold Press Black Ale with twice the cold press and two doses of whole Madagascar vanilla beans. If that wasn’t enough, Bent Paddle aged the beer for 15 months in bourbon barrels. Keep an eye for more information on when and where to find bottles.",6.71,270.0,4.47,315.0,68.0,american black ale,12.0,78.0,bent paddle brewing co. barrel aged double shot double black
1363,8.5,g-bot,https://www.beeradvocate.com/beer/profile/357/57259/,new england brewing co.,/beer/profile/357/,628.0,"Massively hopped double IPA with notes of orange rind, dank pine and citrus with a deceptive drinkability

IBU’s - 85 

Kettle Hops - Columbus, Citra, Simcoe, Columbus & Mosaic Dry Hops - Simcoe, Columbus, Mosaic & Citra

Malt - Pilsner, Crystal, Dextrose

Yeast - American Ale

OG - 17.5",8.66,460.0,4.39,2959.0,600.0,american imperial ipa,7.0,1172.0,new england brewing co. g-bot
1891,6.9,leaf raker,https://www.beeradvocate.com/beer/profile/27979/104397/,mankato brewery,/beer/profile/27979/,5.0,None provided.,14.85,26282.0,3.77,35.0,6.0,english brown ale,0.0,0.0,mankato brewery leaf raker
810,,marty,https://www.beeradvocate.com/beer/profile/39686/163844/,black cloister brewing company,/beer/profile/39686/,2.0,None provided.,5.6,11938.0,4.11,11.0,3.0,belgian pale ale,0.0,1.0,black cloister brewing company marty
1100,6.5,game of thrones: mother of dragons,https://www.beeradvocate.com/beer/profile/42/358074/,brewery ommegang,/beer/profile/42/,19.0,"Smoked Porter & Kriek Ale Blend

A beer for Daenarys. A blend of delicately smoked porter and tart cherry kriek. Brewed for those who nurture dragons.

As the war for the Seven Kingdoms rages to a climax, Ommegang presents the ""Royal Reserve Collection."" This collection of four exclusive and extremely limited release ales available in 2018, is brewed as an homage to the four epic figures still standing against the annihilation of mankind.

""Mother of Dragons"" -- a beer for Daenerys -- is a richly complex blend of smoked porter and Belgian kriek. It pours a deep ruby-brown with alluring aromas of tart cherry, dark roast and hints of smoke.

""Mother of Dragons"" is the third release in our Royal Reserve Collection. These are the beers representing what a court brewer would offer a noble lord or lady, perfect balance and pure drinking pleasure.",7.77,,3.86,132.0,56.0,smoke porter,0.0,6.0,brewery ommegang game of thrones: mother of dragons
868,6.3,luminaire,https://www.beeradvocate.com/beer/profile/34102/191643/,banded brewing co.,/beer/profile/34102/,12.0,"IPL
A fusion of our love for brewing hoppy, punchy ales and snappy, crisp lagers. Tropical, spicy, bright + crushable. Azacca & Summit hops.",7.21,9922.0,4.02,58.0,21.0,american lager,0.0,2.0,banded brewing co. luminaire
1309,7.0,prouty's irish red ale,https://www.beeradvocate.com/beer/profile/1432/67643/,jackie o's pub & brewery,/beer/profile/1432/,1.0,"""Hoppy Red Ale brewed in memory of our friend Jim.""",15.09,18936.0,3.91,15.0,2.0,irish red ale,0.0,1.0,jackie o's pub & brewery prouty's irish red ale
1382,6.0,seed (2015),https://www.beeradvocate.com/beer/profile/33519/179682/,bissell brothers brewing co.,/beer/profile/33519/,12.0,"We crafted an ale with a half-ton of pesticide-free, Maine-grown strawberries and raspberries from our friends at the Bradbury Mountain Berry Farm in Pownal.",7.62,7867.0,4.07,54.0,11.0,fruit and field beer,0.0,7.0,bissell brothers brewing co. seed (2015)
592,5.1,seven giraffes,https://www.beeradvocate.com/beer/profile/12142/40903/,williams brothers brewing company,/beer/profile/12142/,16.0,None provided.,10.79,23932.0,3.8,82.0,26.0,english extra special / strong bitter (esb),0.0,2.0,williams brothers brewing company seven giraffes
1085,6.0,what the phở?,https://www.beeradvocate.com/beer/profile/35363/143159/,marz community brewing,/beer/profile/35363/,5.0,pho spiced porter,23.03,44305.0,3.17,19.0,3.0,robust porter ,0.0,2.0,marz community brewing what the phở?
1290,5.4,frau blucher,https://www.beeradvocate.com/beer/profile/22928/79061/,barrier brewing company,/beer/profile/22928/,1.0,None provided.,9.47,24170.0,3.8,40.0,6.0,smoke beer,0.0,3.0,barrier brewing company frau blucher
745,5.2,best bitter,https://www.beeradvocate.com/beer/profile/4832/58154/,triumph brewing company,/beer/profile/4832/,1.0,None provided.,9.92,28081.0,3.73,13.0,2.0,english bitter,0.0,0.0,triumph brewing company best bitter
538,13.0,schnee boot,https://www.beeradvocate.com/beer/profile/898/381707/,heavy seas beer,/beer/profile/898/,5.0,None provided.,7.04,,4.12,38.0,16.0,german eisbock,0.0,1.0,heavy seas beer schnee boot
649,8.0,bud light lime raz-ber-rita,https://www.beeradvocate.com/beer/profile/29/110749/,anheuser-busch,/beer/profile/29/,44.0,None provided.,28.24,47503.0,2.55,149.0,25.0,american malt liquor,0.0,1.0,anheuser-busch bud light lime raz-ber-rita
749,4.6,vanilla cream abdul jabbar,https://www.beeradvocate.com/beer/profile/31805/116684/,funky buddha brewery,/beer/profile/31805/,0.0,None provided.,9.14,10158.0,4.05,29.0,6.0,american cream ale,0.0,23.0,funky buddha brewery vanilla cream abdul jabbar
244,9.2,gordon biersch imperial pilsner,https://www.beeradvocate.com/beer/profile/1551/56067/,gordon biersch brewery restaurant,/beer/profile/1551/,0.0,None provided.,8.67,30202.0,3.69,16.0,2.0,american imperial pilsner,0.0,0.0,gordon biersch brewery restaurant gordon biersch imperial pilsner
1819,7.0,innstadt bock weisse,https://www.beeradvocate.com/beer/profile/6052/27673/,innstadt brauerei,/beer/profile/6052/,1.0,None provided.,14.06,26198.0,3.77,23.0,16.0,german weizenbock,0.0,1.0,innstadt brauerei innstadt bock weisse
1490,4.8,schiehallion,https://www.beeradvocate.com/beer/profile/323/6438/,harviestoun brewery ltd.,/beer/profile/323/,27.0,None provided.,13.6,27811.0,3.75,149.0,67.0,european pale lager,0.0,22.0,harviestoun brewery ltd. schiehallion
476,9.0,something something darkside,https://www.beeradvocate.com/beer/profile/31624/123701/,weird beard brew co.,/beer/profile/31624/,2.0,None provided.,9.78,9873.0,4.09,20.0,6.0,american black ale,0.0,1.0,weird beard brew co. something something darkside
2239,7.2,cold front,https://www.beeradvocate.com/beer/profile/651/52334/,ithaca beer company,/beer/profile/651/,19.0,None provided.,15.47,36817.0,3.62,346.0,147.0,belgian dark ale,0.0,9.0,ithaca beer company cold front
2625,6.2,drift line - coffee,https://www.beeradvocate.com/beer/profile/26676/193090/,kane brewing company,/beer/profile/26676/,3.0,None provided.,4.46,8237.0,4.26,10.0,2.0,american brown ale,0.0,2.0,kane brewing company drift line - coffee
534,5.0,spectral focus new england style lager,https://www.beeradvocate.com/beer/profile/25811/267629/,south county brewing co.,/beer/profile/25811/,0.0,None provided.,6.53,22922.0,3.83,17.0,6.0,german helles,0.0,0.0,south county brewing co. spectral focus new england style lager
606,6.5,cael & crede ale,https://www.beeradvocate.com/beer/profile/35508/286397/,carrig brewing co.,/beer/profile/35508/,8.0,"An amber ale that is distinctly Irish, the unforgettable flavour of Cael and Crede comes from its aging in genuine Irish Whiskey oak barrels. Using locally sourced Irish malts and the purest water from the river Shannon, Cael and Crede's remarkable taste boasts rich toffee with a creamy oak and dry whiskey finish.",9.69,17834.0,3.92,18.0,9.0,irish red ale,0.0,1.0,carrig brewing co. cael & crede ale
2080,6.3,chocolate milk stout,https://www.beeradvocate.com/beer/profile/30349/89146/,dangerous man brewing,/beer/profile/30349/,43.0,None provided.,7.96,1642.0,4.27,206.0,15.0,american stout,1.0,60.0,dangerous man brewing chocolate milk stout
