,abv,beer,beer_url,brewery,brewery_profile_url,gots,note,pdev,rank,rating,ratings_count,review_count,style,trade,wants,review_id
268,4.3,rebel red,https://www.beeradvocate.com/beer/profile/2294/5802/,franciscan well micro brewery,/beer/profile/2294/,30.0,A malt driven Irish style red ale balance by the hop varieties Fuggles and East Kent Golding.,12.94,30573.0,3.71,84.0,22.0,irish red ale,0.0,1.0,franciscan well micro brewery rebel red
859,3.5,lord proprietor's mild,https://www.beeradvocate.com/beer/profile/52742/113180/,edmund's oast brewing company,/beer/profile/52742/,5.0,"When King Charles II gave the Province of Carolina to his buddies, they were known as the Lords Proprietor. In honor of our city’s heritage, we have attempted to blend something uniquely Charleston with something uniquely English.

Infusing black tea from Charleston Tea Plantation (America’s only tea plantation) into a traditional English-style Mild, we have married the surprisingly complementary flavors of tea and roasted barley. Notes of tea, coffee, cocoa, and caramel meld seamlessly into this quintessential session ale.",13.89,14277.0,3.96,31.0,12.0,english dark mild ale,0.0,1.0,edmund's oast brewing company lord proprietor's mild
144,5.0,mother lager,https://www.beeradvocate.com/beer/profile/96/12743/,magic hat brewing company,/beer/profile/96/,34.0,"The Evolved Euro-Style Lager. Brewed to spur the people to unite in the fight for imbibing emancipation and smash the oppressive tyranny of malt monotony! Mother Lager was a refreshing, evolved alternative to the familiar Euro-style imports, exported from the People's Republic of Vermont.

17 IBU",14.63,44273.0,3.35,135.0,81.0,european pale lager,0.0,1.0,magic hat brewing company mother lager
1388,8.0,bourbon barrel porter,https://www.beeradvocate.com/beer/profile/19321/61603/,shawneecraft brewing company,/beer/profile/19321/,11.0,None provided.,13.14,17991.0,3.88,64.0,15.0,english porter,0.0,4.0,shawneecraft brewing company bourbon barrel porter
2481,5.0,keller pilsner,https://www.beeradvocate.com/beer/profile/32889/133244/,persephone brewing,/beer/profile/32889/,0.0,None provided.,7.31,23440.0,3.83,11.0,1.0,german kellerbier / zwickelbier,0.0,0.0,persephone brewing keller pilsner
1808,7.2,elephant beer,https://www.beeradvocate.com/beer/profile/721/1996/,carlsberg danmark a/s,/beer/profile/721/,115.0,"Carlsberg Elephant is a so-called ’Bock Bier’, brewed for the first time in 1959. The ample use of malt gives Carlsberg Elephant a vinous and rich character with apple, melon, banana, and caramel flavours balanced with a dry bitterness and hints of oak, bark, nuts and pine needles. The colours is pale gold with white foam.

The elephants on the beer’s label are inspired by the two pair life-size elephant statues, which form part of the main entrance to the Carlsberg Group’s headquarters in Copenhagen.",23.67,47188.0,2.83,796.0,347.0,european strong lager,0.0,12.0,carlsberg danmark a/s elephant beer
1628,,herkules kölsch,https://www.beeradvocate.com/beer/profile/32906/114372/,schilling beer co.,/beer/profile/32906/,3.0,None provided.,13.33,12894.0,4.05,14.0,4.0,german kölsch,0.0,1.0,schilling beer co. herkules kölsch
2648,6.7,thirst mutilator,https://www.beeradvocate.com/beer/profile/9629/99425/,short's brewing company,/beer/profile/9629/,9.0,"Thirst Mutilator is a light straw-blonde Munich Helles Style Lager with sharp doughy yeast esters that gather atop a perfectly retained head. Pronounced grain flavors of lightly kilned barley produce bready and flour-like qualities that blend pleasantly with mild hop bitterness. Aided by a wonderful effervescence, these delicate flavors fade into a crisp, clean, and refreshing finish. 

25 IBU",10.03,24839.0,3.79,54.0,9.0,german helles,0.0,0.0,short's brewing company thirst mutilator
878,4.3,buffalo bitter,https://www.beeradvocate.com/beer/profile/1001/5463/,firehouse brewing co.,/beer/profile/1001/,0.0,None provided.,13.98,28527.0,3.72,13.0,3.0,english bitter,0.0,0.0,firehouse brewing co. buffalo bitter
573,5.5,arbor brewing batch 1000 smoked lager,https://www.beeradvocate.com/beer/profile/1457/13743/,arbor brewing company,/beer/profile/1457/,1.0,None provided.,16.39,30859.0,3.66,11.0,8.0,smoke beer,0.0,1.0,arbor brewing company arbor brewing batch 1000 smoked lager
157,5.5,spectra hoppy pilsner,https://www.beeradvocate.com/beer/profile/33058/248525/,ecliptic brewing,/beer/profile/33058/,0.0,"Spectra Hoppy Pilsner casts an array of spicy and herbal hop flavors and aromas from Sterling and Mandarina Bavaria hops. Brewed in the unfiltered Kellerbier style, pale malt works with the yeast left in the beer to create a crisp and hoppy lager.",6.63,18860.0,3.92,13.0,6.0,german kellerbier / zwickelbier,0.0,3.0,ecliptic brewing spectra hoppy pilsner
533,5.5,sticke altbier,https://www.beeradvocate.com/beer/profile/17287/87011/,wedge brewing company,/beer/profile/17287/,0.0,None provided.,9.65,28272.0,3.73,17.0,2.0,german altbier,0.0,0.0,wedge brewing company sticke altbier
886,5.0,english pale ale,https://www.beeradvocate.com/beer/profile/39301/173676/,black swan brewing co.,/beer/profile/39301/,4.0,"A traditional, malt-forward, British-style beer, light copper in colour. Enjoy its moderate hop flavour and light bitterness.",4.45,23799.0,3.82,12.0,1.0,english pale ale,0.0,0.0,black swan brewing co. english pale ale
509,5.4,alhambra negra,https://www.beeradvocate.com/beer/profile/9262/22584/,"grupo cervezas alhambra, sl",/beer/profile/9262/,9.0,None provided.,15.5,45006.0,3.29,158.0,94.0,european dark lager,0.0,5.0,"grupo cervezas alhambra, sl alhambra negra"
864,5.8,bobo's robust porter,https://www.beeradvocate.com/beer/profile/751/32648/,big sky brewing company,/beer/profile/751/,17.0,"A small bottle with big flavor! Brewed with six different malts and generously hopped, robust doesn't really begin to describe this beer. Smooth chocolate flavors with hints of Coffee, Caramel and Vanilla. Hop presence is copious and is matched by rich malt flavors.

32 IBU",10.7,21194.0,3.83,244.0,107.0,robust porter ,0.0,8.0,big sky brewing company bobo's robust porter
1361,4.0,biscuit bitter,https://www.beeradvocate.com/beer/profile/40976/241595/,2sp brewing company,/beer/profile/40976/,1.0,None provided.,5.01,25348.0,3.79,10.0,2.0,english bitter,0.0,0.0,2sp brewing company biscuit bitter
589,5.9,7 course red,https://www.beeradvocate.com/beer/profile/28091/82385/,free will brewing co.,/beer/profile/28091/,1.0,"This Irish red is a beefed up version of the traditional style. Notes of caramel and roast in the aroma lead to an assertive malt profile with notes of toffee and dried fruit. This full bodied, stoplight red beer is balanced by just the right amount of hop bitterness and finishes with a mild sweetness. Pair this beer with roasted pork loin, bbq beef brisket, or traditional cornbeef and cabbage.",12.88,32755.0,3.65,23.0,4.0,irish red ale,0.0,2.0,free will brewing co. 7 course red
129,4.5,sesiόn cerveza,https://www.beeradvocate.com/beer/profile/5316/273146/,full sail brewing company,/beer/profile/5316/,5.0,"Straw gold in color, and light in body, Sesiόn Cerveza is brewed with Pilsner malt, flaked corn, and Celeia and Northern Brewer hops. The hops impart subtle hints of lemon and spice to complement the crisp malt body.",12.99,38859.0,3.54,41.0,16.0,american light lager,0.0,2.0,full sail brewing company sesiόn cerveza
232,,elevator schmidt's gold,https://www.beeradvocate.com/beer/profile/1464/9362/,elevator brewery & draught haus,/beer/profile/1464/,4.0,None provided.,8.65,29075.0,3.7,10.0,3.0,european export / dortmunder,0.0,0.0,elevator brewery & draught haus elevator schmidt's gold
2260,5.0,san miguel dark lager,https://www.beeradvocate.com/beer/profile/355/7102/,san miguel brewery inc.,/beer/profile/355/,20.0,None provided.,15.99,42999.0,3.44,270.0,176.0,european dark lager,0.0,8.0,san miguel brewery inc. san miguel dark lager
2275,,barley's christmas ale,https://www.beeradvocate.com/beer/profile/1513/20927/,smokehouse brewing co.,/beer/profile/1513/,2.0,None provided.,13.16,24714.0,3.8,14.0,7.0,herb and spice beer,0.0,2.0,smokehouse brewing co. barley's christmas ale
383,7.3,mourning wood,https://www.beeradvocate.com/beer/profile/16773/76109/,local option,/beer/profile/16773/,49.0,"Formerly Morning Wood

Mourning Wood is an oak-aged coffee amber ale. Fresh American oak used during the aging process and Dark Matter’s El Salvador San Jose pulp-natural coffee aromatically drive the beer yet they remain subtle components of the beers’ overall flavor profile. This amber colored, medium-bodied, and extraordinarily well-balanced ale has a delicate taste that is appreciated by beer drinkers of all palates.",9.9,20227.0,3.84,506.0,76.0,american amber / red ale,5.0,14.0,local option mourning wood
2512,5.8,yellow fever,https://www.beeradvocate.com/beer/profile/34318/138385/,comrade brewing company,/beer/profile/34318/,2.0,None provided.,8.63,6674.0,4.17,23.0,3.0,american blonde ale,0.0,2.0,comrade brewing company yellow fever
1953,7.0,general washington's tavern porter (bourbon barrel aged),https://www.beeradvocate.com/beer/profile/450/62472/,yards brewing co.,/beer/profile/450/,25.0,Also known as Washington's Reserve,9.56,6798.0,4.08,85.0,17.0,english porter,0.0,15.0,yards brewing co. general washington's tavern porter (bourbon barrel aged)
421,8.1,foggiest window,https://www.beeradvocate.com/beer/profile/28657/306979/,monkish brewing co.,/beer/profile/28657/,2.0,None provided.,5.95,1135.0,4.54,21.0,2.0,american imperial ipa,0.0,5.0,monkish brewing co. foggiest window
330,0.5,carlsberg non-alcoholic,https://www.beeradvocate.com/beer/profile/721/30367/,carlsberg danmark a/s,/beer/profile/721/,1.0,None provided.,23.35,46470.0,2.57,13.0,5.0,low alcohol beer,0.0,1.0,carlsberg danmark a/s carlsberg non-alcoholic
1789,8.5,double dark chocolate bock,https://www.beeradvocate.com/beer/profile/32478/110271/,battlefield brew works,/beer/profile/32478/,2.0,None provided.,6.48,15555.0,4.01,11.0,2.0,german doppelbock,0.0,0.0,battlefield brew works double dark chocolate bock
663,6.2,oops! i hopped my pants!,https://www.beeradvocate.com/beer/profile/39356/194436/,sand city brewing co.,/beer/profile/39356/,13.0,None provided.,6.31,2130.0,4.28,66.0,16.0,american ipa,0.0,7.0,sand city brewing co. oops! i hopped my pants!
15,7.5,gggreennn!,https://www.beeradvocate.com/beer/profile/28743/350694/,tree house brewing company,/beer/profile/28743/,36.0,"Green is an unequivocal crew favorite at Tree House. Over the years we have resisted the urge to brew GGGreennn as we have worked very hard to make Green the very best beer it can be with a carefully refined base beer and a very large kettle and dry hop additions. It's easy to overdo it, but over time we have learned how to adjust our process brewing the base beer to successfully accommodate a larger and larger hope additions without importing off putting characteristics. For GGGreennn, we pushed those principles to the extreme. The result is a richly hop saturated beer featuring notes of pineapple, guava, dried jackfruit, tropical fruit, and citrus. It carries a richness about it that is unique to classic Green, and yet never challenges or tires the palate. It is a pleasure to drink all the way through the glass. It is a beer we are proud to share with you, and hopefully it can serve to enhance a meaningful moment for you this summer.",6.09,81.0,4.6,189.0,29.0,new england ipa,0.0,41.0,tree house brewing company gggreennn!
2006,6.0,montecore oktoberfest,https://www.beeradvocate.com/beer/profile/25667/192385/,austin beerworks,/beer/profile/25667/,0.0,None provided.,11.11,16720.0,3.96,14.0,2.0,german märzen / oktoberfest,0.0,0.0,austin beerworks montecore oktoberfest
717,6.7,knecht ruprecht ii,https://www.beeradvocate.com/beer/profile/30380/149675/,the lone pint brewery,/beer/profile/30380/,3.0,"Our second holiday ale is a Ghost Chile Robust Porter. It uses Maris Otter as the base malt, a crazy variety of specialty malts, and American hops. Ghost Chiles were added both in the kettle and post-fermentation.",11.3,7730.0,4.16,19.0,3.0,american porter,0.0,2.0,the lone pint brewery knecht ruprecht ii
306,5.5,dead leaf green,https://www.beeradvocate.com/beer/profile/863/30908/,russian river brewing company,/beer/profile/863/,7.0,None provided.,9.89,28482.0,3.74,93.0,17.0,english pale ale,0.0,5.0,russian river brewing company dead leaf green
1647,5.0,nate’s nut brown ale,https://www.beeradvocate.com/beer/profile/31542/98721/,chestnut brew works,/beer/profile/31542/,5.0,None provided.,7.42,7874.0,4.18,16.0,0.0,american brown ale,0.0,4.0,chestnut brew works nate’s nut brown ale
1638,4.7,brewed awakening,https://www.beeradvocate.com/beer/profile/28772/80020/,the cromarty brewing company,/beer/profile/28772/,4.0,None provided.,11.69,22285.0,3.85,13.0,6.0,english stout,0.0,0.0,the cromarty brewing company brewed awakening
2347,7.5,cda,https://www.beeradvocate.com/beer/profile/29573/91373/,pfriem family brewers,/beer/profile/29573/,7.0,None provided.,8.27,7047.0,4.11,39.0,10.0,american black ale,0.0,0.0,pfriem family brewers cda
1829,10.0,sled dog trippel bock,https://www.beeradvocate.com/beer/profile/611/9131/,wagner valley brewing co.,/beer/profile/611/,7.0,None provided.,11.06,7170.0,4.07,85.0,45.0,german doppelbock,0.0,18.0,wagner valley brewing co. sled dog trippel bock
984,6.0,aaah bock,https://www.beeradvocate.com/beer/profile/23052/91753/,great river brewery,/beer/profile/23052/,8.0,None provided.,16.03,30885.0,3.68,18.0,2.0,german bock,0.0,2.0,great river brewery aaah bock
424,5.6,copperpop,https://www.beeradvocate.com/beer/profile/35769/166416/,bauhaus brew labs,/beer/profile/35769/,5.0,None provided.,11.86,29919.0,3.71,30.0,5.0,american amber / red lager,0.0,0.0,bauhaus brew labs copperpop
800,,dark horse ice,https://www.beeradvocate.com/beer/profile/782/49867/,"city brewing company, llc",/beer/profile/782/,0.0,None provided.,28.13,46897.0,2.24,11.0,9.0,american malt liquor,0.0,0.0,"city brewing company, llc dark horse ice"
1872,4.8,reality czeck,https://www.beeradvocate.com/beer/profile/763/22173/,moonlight brewing company,/beer/profile/763/,18.0,"A delicate soft Lager, authentic to the west coast of the Czech Republic.",9.6,1543.0,4.27,298.0,149.0,bohemian pilsener,0.0,256.0,moonlight brewing company reality czeck
963,5.5,stoneface porter,https://www.beeradvocate.com/beer/profile/34132/146647/,stoneface brewing co.,/beer/profile/34132/,28.0,"Our robust porter utilizes a myriad of dark malts that impart coffee and chocolate notes. This roasty profile makes for a smooth and incredibly drinkable beer. Medium bodied, balanced and finishing slightly dry, our Porter is perfectly suited for enjoying multiple pints.",8.25,4735.0,4.12,173.0,37.0,american porter,1.0,4.0,stoneface brewing co. stoneface porter
1672,6.0,black,https://www.beeradvocate.com/beer/profile/11269/27432/,brugge brasserie,/beer/profile/11269/,1.0,None provided.,12.17,25501.0,3.78,68.0,42.0,belgian dark ale,0.0,1.0,brugge brasserie black
1640,6.5,rieder xxx weisse,https://www.beeradvocate.com/beer/profile/7285/56406/,brauerei ried,/beer/profile/7285/,1.0,None provided.,22.29,42538.0,3.32,20.0,12.0,german weizenbock,0.0,0.0,brauerei ried rieder xxx weisse
1126,7.9,sweet potato casserole strong ale,https://www.beeradvocate.com/beer/profile/31805/85885/,funky buddha brewery,/beer/profile/31805/,107.0,"Drop the dressing and ditch the pumpkin, Sweet Potato Casserole is fresh out of the oven and ready to party. This fall treat is just like moms used to make - only if moms had penchant for gooey marshmallow, fall spices, and gobs of sweet potato cavorting in one sinful glass. Bottoms up.

Food pairings suggestions:
Turkey, mashed potatoes, dressing, and gravy. Pecan pie. Roast pork loin. Salisbury steak. Corned beef hash. Pumpkin pancakes with walnuts and maple syrup.",11.39,12094.0,3.95,444.0,81.0,fruit and field beer,5.0,56.0,funky buddha brewery sweet potato casserole strong ale
644,7.7,doppel sticky,https://www.beeradvocate.com/beer/profile/220/189994/,lagunitas brewing company,/beer/profile/220/,59.0,"This fruity, estery double altbier is brewed in the traditional-ish style of the Doppelsticke, which is the widely known secret Germanic-esque strong ale. Like it's California Common counterpart, we fermented this ale at a lower temperature to pull out the sulphur-y bite from the yeast, then dry-hopped it with some dank, Sticky hops, including some brand-spankin'-new Enigma hops from the great Down Under! 

66 IBUs",7.39,6653.0,4.06,282.0,91.0,german altbier,0.0,32.0,lagunitas brewing company doppel sticky
2564,6.1,kitsch hoppy lager,https://www.beeradvocate.com/beer/profile/13014/345575/,surly brewing company,/beer/profile/13014/,2.0,None provided.,6.92,18045.0,3.9,26.0,11.0,american lager,0.0,1.0,surly brewing company kitsch hoppy lager
981,5.8,schell's imperial alt,https://www.beeradvocate.com/beer/profile/417/254732/,august schell brewing company,/beer/profile/417/,1.0,None provided.,6.97,13263.0,4.02,17.0,9.0,german altbier,0.0,0.0,august schell brewing company schell's imperial alt
299,8.0,bleuet du fermier,https://www.beeradvocate.com/beer/profile/32319/221417/,side project brewing,/beer/profile/32319/,20.0,"Bleuet du Fermier is our delicate and aromatic Saison du Fermier aged with blueberries in French Oak wine barrels. The brightness, depth, and rustic character are created by the wild yeast native to our family's Missouri farm. This Blueberry Saison was fermented in and aged in wine barrels for several months.",5.16,478.0,4.46,81.0,9.0,belgian saison,4.0,34.0,side project brewing bleuet du fermier
255,6.0,king cobra premium malt liquor,https://www.beeradvocate.com/beer/profile/29/66/,anheuser-busch,/beer/profile/29/,88.0,"King Cobra is an American malt liquor with a robust and full-bodied, smooth, clean taste.",40.38,47706.0,2.08,560.0,202.0,american malt liquor,0.0,9.0,anheuser-busch king cobra premium malt liquor
1816,8.5,boom imperial pilsner,https://www.beeradvocate.com/beer/profile/29123/81689/,explosion brewing company,/beer/profile/29123/,2.0,None provided.,16.11,45239.0,2.98,15.0,10.0,american imperial pilsner,0.0,1.0,explosion brewing company boom imperial pilsner
2544,7.2,allgäuer cambonator doppelbock,https://www.beeradvocate.com/beer/profile/890/2863/,allgäuer brauhaus ag,/beer/profile/890/,0.0,None provided.,11.75,21503.0,3.83,99.0,88.0,german doppelbock,0.0,0.0,allgäuer brauhaus ag allgäuer cambonator doppelbock
1025,8.1,society & solitude #6,https://www.beeradvocate.com/beer/profile/22511/90634/,hill farmstead brewery,/beer/profile/22511/,76.0,Imperial Pale Ale brewed almost exclusively with Mosaic hops from the Pacific Northwest.,5.75,136.0,4.52,944.0,106.0,new england ipa,0.0,237.0,hill farmstead brewery society & solitude #6
2156,8.0,maudite,https://www.beeradvocate.com/beer/profile/22/33/,unibroue,/beer/profile/22/,737.0,"Without a doubt Unibroue’s best-known beer, La Maudite is inspired by abbey beers and Belgian double-style ales. It first hit the shelves in 1992 and took the province by storm with its 8% alcohol content, making it the first strong beer available in grocery stores.

That’s where the idea came to tie its name and branding to a pact signed with the devil. The illustration of the “chasse-galerie” (or flying canoe) from a beloved Quebec legend captures the spirit of the beer.",10.48,2357.0,4.2,4754.0,1982.0,belgian dubbel,4.0,259.0,unibroue maudite
969,6.5,abbey ale,https://www.beeradvocate.com/beer/profile/22271/56719/,cathedral square brewery,/beer/profile/22271/,18.0,"This traditional Belgian-style ale is brewed using five malts, two hop varieties and authentic Trappist Belgian yeast.",13.17,38421.0,3.57,72.0,32.0,belgian dark ale,0.0,5.0,cathedral square brewery abbey ale
495,5.1,organic raspberry,https://www.beeradvocate.com/beer/profile/113/47410/,samuel smith old brewery (tadcaster),/beer/profile/113/,89.0,"Handcrafted at the tiny All Saints Brewery set in a time warp in Stamford using the old manually operated brewing equipment. Finest organically grown barley and wheat are used to create a complex ale which, having undergone primary and secondary fermentation with different yeasts and extended maturation, is taken to Samuel Smith’s small, independent British brewery at Tadcaster. There it is blended with pure organic raspberry fruit juice and a previously cellared organic brew - creating an unparalleled fruit ale . The smooth distinctive character of the matured beer serves as the perfect counterpoint to the pure organic fruit juice.",11.63,17787.0,3.87,537.0,184.0,fruit and field beer,0.0,43.0,samuel smith old brewery (tadcaster) organic raspberry
1740,5.8,mountain momma,https://www.beeradvocate.com/beer/profile/22611/167147/,bridge brew works llc,/beer/profile/22611/,4.0,None provided.,7.93,18724.0,3.91,16.0,4.0,english pale ale,0.0,0.0,bridge brew works llc mountain momma
636,7.0,forest king american stout,https://www.beeradvocate.com/beer/profile/38015/151725/,lost forty brewery,/beer/profile/38015/,3.0,None provided.,9.74,8481.0,4.21,12.0,2.0,american stout,0.0,1.0,lost forty brewery forest king american stout
2629,4.8,shark tracker light lager,https://www.beeradvocate.com/beer/profile/261/143599/,cisco brewers inc.,/beer/profile/261/,5.0,"Cisco Brewers and OCEARCH have teamed up to produce a beer which will benefit research and education on Apex predators of the ocean while inspiring fascination rather than fear.
Last year OCEARCH was invited to speak on Nantucket and the interest that ensued by both locals and tourists was unbelievable. 

The first steps were deciding on the beer, then the package and then the bait to get people to bite at retail. After sampling several styles of beer, the consensus was that a light lager would be best. Something you could enjoy on a boat or the beach, while fishing with your buddies. Samples of 4 styles of beer were shipped out to the key decision makers.

Cisco brought on HP's Aurasma software who will be powering the can. Through augmented reality, each can of Shark Tracker will allow the consumer to scan the logo on the can after downloading the OCEARCH Shark tracker app.
Updates from the OCEARCH crew and exclusive video content as well as shark locations can all be viewed through your phone. 
The first round of the these cans are already committed and retailers should see them throughout Mass in July & just in time for Shark Week in August. ""Fisch""and Berger of OCEARCH along with Jay Harman of Cisco Brewers see global potential for this brand and are already working on an international & multilingual can that can be distributed as OCEARCH plans their next expedition.",16.82,44806.0,3.21,34.0,5.0,american light lager,0.0,0.0,cisco brewers inc. shark tracker light lager
2184,4.8,off black,https://www.beeradvocate.com/beer/profile/44197/226952/,hopewell brewing co.,/beer/profile/44197/,1.0,"The idea was what if we stained First Lager black with chocolate malt – a bit of a trick of the eye? But Off-Black became so much more than that. The color is truly deep, but a careful observer will see the softer tones of brown and red creeping in, thus the name ‘Off Black.’ The subtle roasty astringency of the dark malts interacts in concert with the styrian golding hops to give a refreshingly new palate to our take on a pilsner.",6.17,20682.0,3.89,11.0,4.0,german schwarzbier,0.0,0.0,hopewell brewing co. off black
1758,5.1,fuggle & barleycorn,https://www.beeradvocate.com/beer/profile/343/2625/,"jasper murdock’s alehouse, dining room & microbrewery (the norwich inn)",/beer/profile/343/,2.0,None provided.,13.75,14393.0,4.0,16.0,9.0,english pale ale,0.0,4.0,"jasper murdock’s alehouse, dining room & microbrewery (the norwich inn) fuggle & barleycorn"
1161,7.08,the dun glen dubbel,https://www.beeradvocate.com/beer/profile/22611/66673/,bridge brew works llc,/beer/profile/22611/,9.0,None provided.,10.2,15802.0,3.92,46.0,16.0,belgian dubbel,0.0,7.0,bridge brew works llc the dun glen dubbel
86,8.0,white birch tavern ale,https://www.beeradvocate.com/beer/profile/20417/66112/,white birch brewing,/beer/profile/20417/,6.0,"Butter’s Tavern was a fixture of Concord, NH in the eighteenth century. Inspired by their loggerhead ale, we’ve created a Smoked Imperial Brown Ale. Hearty malts, with a nuanced smokiness and smooth finish create our interpretation of this historic ale. We hope you enjoy this slice of New Hampshire history.",15.38,26426.0,3.77,84.0,38.0,smoke beer,0.0,8.0,white birch brewing white birch tavern ale
40,5.5,hoosier red ale,https://www.beeradvocate.com/beer/profile/21974/97273/,big woods brewing co. / quaff on! brewing company,/beer/profile/21974/,5.0,None provided.,13.42,24461.0,3.8,19.0,6.0,irish red ale,0.0,0.0,big woods brewing co. / quaff on! brewing company hoosier red ale
173,8.1,the great pumpkin,https://www.beeradvocate.com/beer/profile/700/33394/,elysian brewing company,/beer/profile/700/,140.0,None provided.,10.9,3995.0,4.13,731.0,202.0,pumpkin beer,1.0,310.0,elysian brewing company the great pumpkin
1407,7.5,tecate titanium (7.5%),https://www.beeradvocate.com/beer/profile/57/367348/,"cervecería cuauhtémoc moctezuma, s.a. de c.v.",/beer/profile/57/,0.0,None provided.,29.44,,2.48,10.0,10.0,american malt liquor,0.0,0.0,"cervecería cuauhtémoc moctezuma, s.a. de c.v. tecate titanium (7.5%)"
2624,4.9,hacklberg urhell,https://www.beeradvocate.com/beer/profile/5830/12278/,brauerei hacklberg,/beer/profile/5830/,1.0,None provided.,16.27,24362.0,3.81,11.0,2.0,german helles,0.0,0.0,brauerei hacklberg hacklberg urhell
367,6.0,rogue farms good chit pilsner,https://www.beeradvocate.com/beer/profile/132/73341/,rogue ales,/beer/profile/132/,38.0,None provided.,13.76,25391.0,3.78,403.0,98.0,bohemian pilsener,0.0,26.0,rogue ales rogue farms good chit pilsner
